{
  "schemaVersion": 1,
  "contract": "kfd-8-atlas-coordinate",
  "standard": "kfd-8",
  "profileVersion": "0.1.0-alpha.1",
  "identity": { "atlasId": "atlas:review", "version": "1", "root": "sha256:aaaaaaaaaaaaaaaaaaaaaaaaaaaaaaaaaaaaaaaaaaaaaaaaaaaaaaaaaaaaaaaa" },
  "holder": { "id": "reviewer", "purpose": "judge the admitted change" },
  "sources": [{ "id": "repository", "authority": "canonical-repository", "relevance": "decision source", "factCutRoot": "sha256:bbbbbbbbbbbbbbbbbbbbbbbbbbbbbbbbbbbbbbbbbbbbbbbbbbbbbbbbbbbbbbbb" }],
  "factCut": { "id": "git:head", "root": "sha256:bbbbbbbbbbbbbbbbbbbbbbbbbbbbbbbbbbbbbbbbbbbbbbbbbbbbbbbbbbbbbbbb" },
  "scope": { "included": ["tracked source"], "omitted": ["untracked local files"], "unknowns": [] },
  "freshness": { "state": "current", "observedAt": "2026-08-10T00:00:00Z", "condition": "valid only for the bound Fact cut" },
  "loss": ["working-tree process context is omitted"],
  "state": { "stale": false, "degraded": false, "conflicted": false },
  "lineage": { "predecessorRoots": [], "transformation": "genesis", "preservedRoots": [] },
  "currentReference": { "id": "atlas:review:current", "pointsToRoot": "sha256:aaaaaaaaaaaaaaaaaaaaaaaaaaaaaaaaaaaaaaaaaaaaaaaaaaaaaaaaaaaaaaaa", "priorRoots": [] },
  "semanticInferences": { "pursuit": false, "warrant": false, "completeness": false, "currentValidity": false },
  "verification": { "claimBoundary": "Structural conformance does not activate KFD-8 or infer authority, direction, completeness, or current validity." }
}
